{
  "protocol": "1",
  "request_id": "biofeedback-001-20260105-143025",
  "source": "biofeedback-device",
  "command": "biofeedback.data",
  "payload": {
    "sensor_id": "hrv-monitor-01",
    "feedback_type": "hrv",
    "value": 65.4,
    "unit": "ms",
    "timestamp": "2026-01-05T14:30:25Z",
    "session_id": "SESSION-2026-001",
    "target_value": 70,
    "progress_percent": 78,
    "rmssd": 42.3,
    "sdnn": 58.7,
    "lf_hf_ratio": 2.1,
    "patient_id": "PAT-2026-00123"
  },
  "meta": {
    "timestamp_utc": "2026-01-05T14:30:25Z",
    "correlation_id": "biofeedback-session-001",
    "content_type": "application/json",
    "schema": "medical-daemon-message",
    "patient_id": "PAT-2026-00123",
    "encryption": false
  }
}
